<?xml version="1.0" encoding="UTF-8"?>

<careerSkillSystem
    xmlns="https://tsw6223.example.edu/career-skill"
    xmlns:xsi="http://www.w3.org/2001/XMLSchema-instance"
    xsi:schemaLocation="https://tsw6223.example.edu/career-skill career_skill_schema.xsd">

    <dataSources>
        <source id="SRC001">
            <sourceName>O*NET OnLine</sourceName>
            <sourceUrl>https://www.onetonline.org/</sourceUrl>
            <description>Used as a real-world reference for occupation descriptions, worker requirements, software skills, essential skills, and career-skill relationships.</description>
        </source>
    </dataSources>

    <skills>
        <skill id="SK001">
            <skillName>Python</skillName>
            <skillCategory>Technical</skillCategory>
            <aliases>
                <alias>python</alias>
                <alias>py</alias>
                <alias>python programming</alias>
                <alias>pyhton</alias>
            </aliases>
        </skill>

        <skill id="SK002">
            <skillName>SQL</skillName>
            <skillCategory>Technical</skillCategory>
            <aliases>
                <alias>sql</alias>
                <alias>structured query language</alias>
                <alias>database query</alias>
            </aliases>
        </skill>

        <skill id="SK003">
            <skillName>Machine Learning</skillName>
            <skillCategory>Technical</skillCategory>
            <aliases>
                <alias>machine learning</alias>
                <alias>ml</alias>
                <alias>machien learning</alias>
            </aliases>
        </skill>

        <skill id="SK004">
            <skillName>Statistics</skillName>
            <skillCategory>Technical</skillCategory>
            <aliases>
                <alias>statistics</alias>
                <alias>statistic</alias>
                <alias>stats</alias>
            </aliases>
        </skill>

        <skill id="SK005">
            <skillName>Data Visualization</skillName>
            <skillCategory>Technical</skillCategory>
            <aliases>
                <alias>data visualization</alias>
                <alias>data visualisation</alias>
                <alias>visualization</alias>
                <alias>dashboard</alias>
            </aliases>
        </skill>

        <skill id="SK006">
            <skillName>Problem Solving</skillName>
            <skillCategory>Essential</skillCategory>
            <aliases>
                <alias>problem solving</alias>
                <alias>problem-solving</alias>
                <alias>analytical thinking</alias>
                <alias>critical thinking</alias>
            </aliases>
        </skill>

        <skill id="SK007">
            <skillName>Web Development</skillName>
            <skillCategory>Technical</skillCategory>
            <aliases>
                <alias>web development</alias>
                <alias>html css javascript</alias>
                <alias>frontend</alias>
                <alias>front end</alias>
            </aliases>
        </skill>

        <skill id="SK008">
            <skillName>Database Management</skillName>
            <skillCategory>Technical</skillCategory>
            <aliases>
                <alias>database management</alias>
                <alias>database</alias>
                <alias>dbms</alias>
                <alias>database systems</alias>
            </aliases>
        </skill>

        <skill id="SK009">
            <skillName>Cybersecurity</skillName>
            <skillCategory>Technical</skillCategory>
            <aliases>
                <alias>cybersecurity</alias>
                <alias>cyber security</alias>
                <alias>security</alias>
                <alias>information security</alias>
            </aliases>
        </skill>

        <skill id="SK010">
            <skillName>Networking</skillName>
            <skillCategory>Technical</skillCategory>
            <aliases>
                <alias>networking</alias>
                <alias>computer network</alias>
                <alias>network</alias>
                <alias>computer networking</alias>
            </aliases>
        </skill>

        <skill id="SK011">
            <skillName>Cloud Computing</skillName>
            <skillCategory>Technical</skillCategory>
            <aliases>
                <alias>cloud computing</alias>
                <alias>cloud</alias>
                <alias>aws</alias>
                <alias>azure</alias>
                <alias>gcp</alias>
            </aliases>
        </skill>

        <skill id="SK012">
            <skillName>DevOps</skillName>
            <skillCategory>Technical</skillCategory>
            <aliases>
                <alias>devops</alias>
                <alias>ci/cd</alias>
                <alias>docker</alias>
                <alias>kubernetes</alias>
            </aliases>
        </skill>

        <skill id="SK013">
            <skillName>API Design</skillName>
            <skillCategory>Technical</skillCategory>
            <aliases>
                <alias>api design</alias>
                <alias>rest api</alias>
                <alias>api</alias>
                <alias>apis</alias>
            </aliases>
        </skill>

        <skill id="SK014">
            <skillName>Java</skillName>
            <skillCategory>Technical</skillCategory>
            <aliases>
                <alias>java</alias>
                <alias>jvm</alias>
            </aliases>
        </skill>
        <skill id="SK015">
            <skillName>C++</skillName>
            <skillCategory>Technical</skillCategory>
            <aliases>
                <alias>c++</alias>
                <alias>cpp</alias>
                <alias>c plus plus</alias>
            </aliases>
        </skill>
        <skill id="SK016">
            <skillName>C#</skillName>
            <skillCategory>Technical</skillCategory>
            <aliases>
                <alias>c#</alias>
                <alias>csharp</alias>
                <alias>.net</alias>
            </aliases>
        </skill>
        <skill id="SK017">
            <skillName>JavaScript</skillName>
            <skillCategory>Technical</skillCategory>
            <aliases>
                <alias>javascript</alias>
                <alias>js</alias>
                <alias>ecmascript</alias>
            </aliases>
        </skill>
        <skill id="SK018">
            <skillName>TypeScript</skillName>
            <skillCategory>Technical</skillCategory>
            <aliases>
                <alias>typescript</alias>
                <alias>ts</alias>
            </aliases>
        </skill>
        <skill id="SK019">
            <skillName>Go</skillName>
            <skillCategory>Technical</skillCategory>
            <aliases>
                <alias>go</alias>
                <alias>golang</alias>
            </aliases>
        </skill>
        <skill id="SK020">
            <skillName>Rust</skillName>
            <skillCategory>Technical</skillCategory>
            <aliases>
                <alias>rust</alias>
                <alias>rs</alias>
            </aliases>
        </skill>
        <skill id="SK021">
            <skillName>Ruby</skillName>
            <skillCategory>Technical</skillCategory>
            <aliases>
                <alias>ruby</alias>
                <alias>ror</alias>
                <alias>ruby on rails</alias>
            </aliases>
        </skill>
        <skill id="SK022">
            <skillName>PHP</skillName>
            <skillCategory>Technical</skillCategory>
            <aliases>
                <alias>php</alias>
                <alias>laravel</alias>
            </aliases>
        </skill>
        <skill id="SK023">
            <skillName>Swift</skillName>
            <skillCategory>Technical</skillCategory>
            <aliases>
                <alias>swift</alias>
                <alias>ios</alias>
            </aliases>
        </skill>
    </skills>

    <careers>
        <career id="C001" sourceRef="SRC001" sourceOccupationCode="15-2051.00">
            <careerName>Data Analyst</careerName>
            <sourceOccupationTitle>Data Scientists</sourceOccupationTitle>
            <careerLevel>Intermediate</careerLevel>
            <sourceNote>Data Analyst is represented using O*NET Data Scientists as a close data-related occupation for this prototype because O*NET search maps data analyst-related work to data science and business intelligence roles.</sourceNote>
            <requiredSkills>
                <requiredSkill ref="SK001" priority="High"/>
                <requiredSkill ref="SK002" priority="High"/>
                <requiredSkill ref="SK004" priority="High"/>
                <requiredSkill ref="SK005" priority="Medium"/>
                <requiredSkill ref="SK006" priority="Medium"/>
            </requiredSkills>
        </career>

        <career id="C002" sourceRef="SRC001" sourceOccupationCode="15-1252.00">
            <careerName>Software Developer</careerName>
            <sourceOccupationTitle>Software Developers</sourceOccupationTitle>
            <careerLevel>Intermediate</careerLevel>
            <sourceNote>Software Developer is directly mapped to O*NET Software Developers. The selected skills reflect programming, development environment software, database-related tools, web platform development software, and essential problem-solving skills shown in O*NET worker requirements.</sourceNote>
            <requiredSkills>
                <requiredSkill ref="SK001" priority="High"/>
                <requiredSkill ref="SK007" priority="High"/>
                <requiredSkill ref="SK008" priority="Medium"/>
                <requiredSkill ref="SK002" priority="Medium"/>
                <requiredSkill ref="SK006" priority="Medium"/>
            </requiredSkills>
        </career>

        <career id="C003" sourceRef="SRC001" sourceOccupationCode="15-1212.00">